{
  "schema": "personal-agent/orchestrator-checkpoint/v1",
  "id": "ORCH-0008",
  "previous": "ORCH-0007",
  "created_at": "2026-09-29T04:14:01.918967+00:00",
  "git": {
    "branch": "orchestrator-os/bootstrap-20260928",
    "commit": "8e42d0f1",
    "dirty": true
  },
  "phase": "P1 foundations: control plane tested, provider health shared; test strength next",
  "completed": [
    "Q-0001 resolved: gpt-6-luna 0.60 vs Sonnet 0.75 vs Haiku 0.65 at pinned base; no route qualifies (floor 0.9); opposite error biases (FND-0004)",
    "CAP records now distinguish accuracy-scored from contract-only evidence (pass_basis, mean_accuracy)",
    "EXP-0001 rejected HYP-0001: evidence verifier had no effect; offline replay predicted it before spend (e6d1f35a, EVR-0006, 9 calls, $1.02 measured)",
    "Run-to-run variance measured: Sonnet 0.55-0.80 on identical calls; all routes 0.67-0.70; voting <= 0.75; only 2/20 items stable (FND-0005, FND-0006)",
    "orchestrate eval gained +verify variants, --samples (paired), --max-calls budget, pooled item-level intervals, bounded parallelism",
    "EXP-0002: affected_test_selection family with deterministic labels; EVR-0007; deterministic import graph wins (DEC-0006, FND-0007, IMP-0006) (5587fbf5)",
    "IMP-0006 implemented: affected-tests-first validation, retries-only default (e7ad1ddc, 42ff2e4f; DEC-0007, EVR-0008..0011, HYP-0003)",
    "Prior-art registry + workflow integration (0d141ef8, DEC-0008)",
    "45 prior-art evaluations + discovery (bf11d932)",
    "Subsumed retry/breaker + key-optional API workers (36377edc, DEC-0009)",
    "IMP-0007 implemented: state-machine invariant tests with shrinking (EXP-0003, FND-0008, DEC-0010)",
    "IMP-0005 implemented: shared provider health, breaker, delegate deferral (aabff0ea, DEC-0011, FND-0009, EVR-0012)"
  ],
  "active_objective": "Prove the control-plane tests actually catch changes to protection logic (mutation testing, PA-mutmut), then return to route qualification and evaluation breadth.",
  "latest_evidence": [
    {
      "id": "DEC-0009",
      "type": "DEC",
      "title": "Subsume retry/backoff, circuit breaker and a key-optional direct API adapter",
      "path": "projects/personal-agent-os/orchestrator-os/records/decisions/DEC-0009.json",
      "updated_at": "2026-09-29T05:10:00+00:00"
    },
    {
      "id": "DEC-0011",
      "type": "DEC",
      "title": "Provider health shared across engine, delegate and eval; breaker for repeated unavailable failures",
      "path": "projects/personal-agent-os/orchestrator-os/records/decisions/DEC-0011.json",
      "updated_at": "2026-09-29T05:00:00+00:00"
    },
    {
      "id": "FAIL-0001",
      "type": "FAIL",
      "title": "Provider quota exhaustion blocked cheap-model delegation",
      "path": "projects/personal-agent-os/orchestrator-os/records/failures/FAIL-0001.json",
      "updated_at": "2026-09-29T05:00:00+00:00"
    },
    {
      "id": "FND-0009",
      "type": "FND",
      "title": "Quota cooldowns already existed in the engine; the bootstrap audit and FAIL-0001 missed them",
      "path": "projects/personal-agent-os/orchestrator-os/records/findings/FND-0009.json",
      "updated_at": "2026-09-29T05:00:00+00:00"
    },
    {
      "id": "DEC-0010",
      "type": "DEC",
      "title": "Orchestrator state-machine tests use the subsumed random-sequence runner; Hypothesis stays optional",
      "path": "projects/personal-agent-os/orchestrator-os/records/decisions/DEC-0010.json",
      "updated_at": "2026-09-29T04:40:00+00:00"
    },
    {
      "id": "EXP-0003",
      "type": "EXP",
      "title": "State-machine testing driver: subsumed random-sequence runner vs Hypothesis RuleBasedStateMachine",
      "path": "projects/personal-agent-os/orchestrator-os/records/experiments/EXP-0003.json",
      "updated_at": "2026-09-29T04:40:00+00:00"
    },
    {
      "id": "FND-0008",
      "type": "FND",
      "title": "A green invariant suite can be vacuous; planted mutations are what prove it checks anything",
      "path": "projects/personal-agent-os/orchestrator-os/records/findings/FND-0008.json",
      "updated_at": "2026-09-29T04:40:00+00:00"
    },
    {
      "id": "DEC-0008",
      "type": "DEC",
      "title": "Open-source prior art becomes a required, registry-backed input to significant design decisions",
      "path": "projects/personal-agent-os/orchestrator-os/records/decisions/DEC-0008.json",
      "updated_at": "2026-09-29T04:20:00+00:00"
    }
  ],
  "open_blockers": [],
  "active_experiments": [
    "HYP-0003 (monitoring): affected_tests_first always vs retries"
  ],
  "recent_decisions": [
    "DEC-0009",
    "DEC-0010",
    "DEC-0011"
  ],
  "next_action": {
    "summary": "Mutation-testing spike (PA-mutmut, INVESTIGATE; motivated by FND-0008): measure how many mutations of src/agent_os/orchestrator/control_plane.py (then validators.py and the review gate in engine.py) the current tests kill. Prefer running mutmut as an external dev tool in .agent-local/venv-dev (no runtime dependency); if it does not run on Windows, subsume a small AST mutator (flip comparisons/booleans, drop returns, negate conditions) scoped to those modules. Report the mutation score, add tests that kill surviving meaningful mutants, and record EXP + DEC with a prior_art note and update PA-mutmut. Protected-path note: control_plane.py and validators.py are protected; mutations must happen only in throwaway copies/worktrees, never committed.",
    "prior_art": "mutation testing python control plane tests",
    "worker_class": "balanced",
    "effort": "medium",
    "why_this_class": "Deterministic tooling and test writing; no model workers needed.",
    "context_refs": [
      "FND-0008",
      "projects/personal-agent-os/research/prior-art/registry.json",
      "src/agent_os/orchestrator/control_plane.py",
      "tests/test_orchestrator_control_plane.py",
      "src/agent_os/orchestrator/validators.py"
    ],
    "stop_conditions": [
      "EXP record with mutation scores before/after and new killing tests committed",
      "0 model calls expected",
      "stop and report if a protected path would have to change in committed code beyond tests, the full suite regresses against known_baseline, or the retry/repair budget is reached"
    ]
  },
  "context_refs": [
    "FND-0008",
    "projects/personal-agent-os/research/prior-art/registry.json",
    "src/agent_os/orchestrator/control_plane.py",
    "tests/test_orchestrator_control_plane.py",
    "src/agent_os/orchestrator/validators.py"
  ],
  "stopping_conditions": [
    "EXP record with mutation scores before/after and new killing tests committed",
    "0 model calls expected",
    "stop and report if a protected path would have to change in committed code beyond tests, the full suite regresses against known_baseline, or the retry/repair budget is reached"
  ],
  "approval_conditions": [
    "Standing authorization (operator, 2026-09-29): commit validated steps to orchestrator-os/bootstrap-20260928; after a gated pass, fast-forward main and push; protected paths only as already granted (validators.py, eval suites, evaluators, eval.py, control_plane.py, review.py, policy/**, AGENTS.md/CLAUDE.md when the next action needs them, each recorded in a DEC); <= 9 model calls per pass, <= $10 measured per night",
    "Operator decision still open: Q-0002 (qualification on pooled item-level intervals)"
  ],
  "next_prompt": "Use the Personal Agent OS repository's canonical Orchestrator development workflow (docs/orchestrator-os/ENTRYPOINT.md) and resume from checkpoint ORCH-0008 (projects/personal-agent-os/orchestrator-os/checkpoints/ORCH-0008.json).\n\nCurrent objective: Prove the control-plane tests actually catch changes to protection logic (mutation testing, PA-mutmut), then return to route qualification and evaluation breadth.\n\nNext action: Mutation-testing spike (PA-mutmut, INVESTIGATE; motivated by FND-0008): measure how many mutations of src/agent_os/orchestrator/control_plane.py (then validators.py and the review gate in engine.py) the current tests kill. Prefer running mutmut as an external dev tool in .agent-local/venv-dev (no runtime dependency); if it does not run on Windows, subsume a small AST mutator (flip comparisons/booleans, drop returns, negate conditions) scoped to those modules. Report the mutation score, add tests that kill surviving meaningful mutants, and record EXP + DEC with a prior_art note and update PA-mutmut. Protected-path note: control_plane.py and validators.py are protected; mutations must happen only in throwaway copies/worktrees, never committed.\n\nBefore implementing, consult the prior-art registry (`agent-os orchestrate prior-art lookup \"mutation testing python control plane tests\"`) and refresh task-specific candidates if the matching entries are stale.\n\nRetrieve only the context referenced by the checkpoint (`agent-os orchestrate checkpoint --show`); load more lazily if needed. Recommended worker class: balanced / effort medium. Delegate cheap read-only work with `agent-os orchestrate delegate` and use the cheapest reliable route under policy/orchestrator-os.policy.json. Baseline before changing behavior, keep protected control-plane paths untouched unless I grant them, and stop at: EXP record with mutation scores before/after and new killing tests committed; 0 model calls expected; stop and report if a protected path would have to change in committed code beyond tests, the full suite regresses against known_baseline, or the retry/repair budget is reached.\n\nFinish by updating projects/personal-agent-os/orchestrator-os/status.json and running `agent-os orchestrate checkpoint --write`, then give me the new next prompt.\n"
}
