{
  "schema": "personal-agent/orchestrator-checkpoint/v1",
  "id": "ORCH-0020",
  "previous": "ORCH-0019",
  "created_at": "2026-09-29T11:56:38.661357+00:00",
  "git": {
    "branch": "orchestrator-os/bootstrap-20260928",
    "commit": "e26f9cee",
    "dirty": true
  },
  "phase": "P1 foundations: failure mining in place; import an attack corpus as data next",
  "completed": [
    "MIE-0011 first slice: orchestrate simplify + report (EXP-0006, DEC-0014); 5 prior-art entries added",
    "Simplification applied: shared record loader, workflow recovery checkpoints reconnected (DEC-0015, FND-0010)",
    "MIE-0017: OTLP trace projection (DEC-0016)",
    "ORCH-0013 pushed after gate rerun",
    "MIE-0007 first slice: EVS-SECURITY suite + fixtures; EXP-0007 (DEC-0017, FND-0011, FND-0012)",
    "Delegate attachments: -68% tokens and latency at equal accuracy (56e60a02, EVR-0013, DEC-0018)",
    "IMP-0012: idempotent integration after crash (6b3c9eaf, FAIL-0003, DEC-0019, EVR-0014)",
    "IMP-0013: write-ahead landing after crash (ee378ff8, FAIL-0004, DEC-0020, EVR-0015)",
    "Append-only negative evidence enforced; approval-rule enforcement map (1a1e107c, DEC-0021)",
    "IMP-0014: worker publication guard + adapter deny defaults (2ff6a550, c07304c3, DEC-0022)",
    "MIE-0004 first slice: orchestrate mining (DEC-0023)",
    "EXP-0008 deferred for safety (FND-0013)"
  ],
  "active_objective": "Give the security suite real adversarial coverage by importing a third-party attack corpus as data (not authored here), and let measured capability begin to inform routing.",
  "latest_evidence": [
    {
      "id": "DEC-0022",
      "type": "DEC",
      "title": "Worker publication is operator-gated: deterministic guard plus adapter deny defaults",
      "path": "projects/personal-agent-os/orchestrator-os/records/decisions/DEC-0022.json",
      "updated_at": "2026-09-29T08:35:00+00:00"
    },
    {
      "id": "DEC-0021",
      "type": "DEC",
      "title": "Negative evidence is append-only, enforced; approval rules mapped to enforcement points",
      "path": "projects/personal-agent-os/orchestrator-os/records/decisions/DEC-0021.json",
      "updated_at": "2026-09-29T08:10:00+00:00"
    },
    {
      "id": "DEC-0023",
      "type": "DEC",
      "title": "Failure/success mining tool (MIE-0004 first slice)",
      "path": "projects/personal-agent-os/orchestrator-os/records/decisions/DEC-0023.json",
      "updated_at": "2026-09-29T08:05:00+00:00"
    },
    {
      "id": "EXP-0008",
      "type": "EXP",
      "title": "Real-model injection against editing workers",
      "path": "projects/personal-agent-os/orchestrator-os/records/experiments/EXP-0008.json",
      "updated_at": "2026-09-29T08:05:00+00:00"
    },
    {
      "id": "FND-0013",
      "type": "FND",
      "title": "Generating adversarial attack fixtures is environment-limited; import corpora as data instead",
      "path": "projects/personal-agent-os/orchestrator-os/records/findings/FND-0013.json",
      "updated_at": "2026-09-29T08:05:00+00:00"
    },
    {
      "id": "DEC-0020",
      "type": "DEC",
      "title": "Write-ahead for landing onto the base branch",
      "path": "projects/personal-agent-os/orchestrator-os/records/decisions/DEC-0020.json",
      "updated_at": "2026-09-29T07:45:00+00:00"
    },
    {
      "id": "FAIL-0004",
      "type": "FAIL",
      "title": "Crash after landing left the base branch moved but the landing gate open",
      "path": "projects/personal-agent-os/orchestrator-os/records/failures/FAIL-0004.json",
      "updated_at": "2026-09-29T07:45:00+00:00"
    },
    {
      "id": "EVR-0015",
      "type": "EVR",
      "title": "EVS-ROUTING: e15c57c1 vs HEAD",
      "path": "projects/personal-agent-os/orchestrator-os/records/evaluations/EVR-0015.json",
      "updated_at": "2026-09-29T07:42:39.567209+00:00"
    }
  ],
  "open_blockers": [],
  "active_experiments": [
    "HYP-0003 (monitoring): affected_tests_first always vs retries"
  ],
  "recent_decisions": [
    "DEC-0021",
    "DEC-0022",
    "DEC-0023"
  ],
  "next_action": {
    "summary": "Import one third-party attack corpus as data (not authored here), to give EVS-SECURITY real adversarial coverage without generating attack payloads. Choose AgentDojo (PA-agentdojo, MIT) injection tasks; add an external-corpora.json entry with verified license and permissions, a small deterministic importer that fetches the repo's published cases at a pinned revision into a machine-local path (never committed) and derives EVS-SECURITY development cases (attacker text as data, known-good labels, canary tokens), and record provenance. If fetching is not available in this environment, instead build the importer + schema and record the corpus entry as status=candidate with the exact steps, so a later run completes it. No model calls; if a delegate is used to summarize the corpus README, cap at 2 calls.",
    "prior_art": "prompt injection benchmark dataset agentdojo import",
    "worker_class": "balanced",
    "effort": "medium",
    "why_this_class": "Deterministic import/registry work; judgment in license verification.",
    "context_refs": [
      "FND-0013",
      "projects/personal-agent-os/orchestrator-os/evals/external-corpora.json",
      "schemas/external-corpus-v1.schema.json",
      "projects/personal-agent-os/research/prior-art/registry.json",
      "src/agent_os/orchestrator/eval.py"
    ],
    "stop_conditions": [
      "corpus registry entry with verified permissions + importer + tests committed; EVS-SECURITY cases derived or the exact completion steps recorded",
      "<= 2 model calls",
      "stop and report if network fetch is unavailable (record candidate + steps), a protected path beyond the standing grants must change, or the retry/repair budget is reached"
    ]
  },
  "context_refs": [
    "FND-0013",
    "projects/personal-agent-os/orchestrator-os/evals/external-corpora.json",
    "schemas/external-corpus-v1.schema.json",
    "projects/personal-agent-os/research/prior-art/registry.json",
    "src/agent_os/orchestrator/eval.py"
  ],
  "stopping_conditions": [
    "corpus registry entry with verified permissions + importer + tests committed; EVS-SECURITY cases derived or the exact completion steps recorded",
    "<= 2 model calls",
    "stop and report if network fetch is unavailable (record candidate + steps), a protected path beyond the standing grants must change, or the retry/repair budget is reached"
  ],
  "approval_conditions": [
    "Operator decision still open: Q-0002 (qualification on pooled item-level intervals)",
    "Operator decision requested: which EVS-SECURITY adversarial cases move to a protected holdout (DEC-0017)"
  ],
  "next_prompt": "Use the Personal Agent OS repository's canonical Orchestrator development workflow (docs/orchestrator-os/ENTRYPOINT.md) and resume from checkpoint ORCH-0020 (projects/personal-agent-os/orchestrator-os/checkpoints/ORCH-0020.json).\n\nCurrent objective: Give the security suite real adversarial coverage by importing a third-party attack corpus as data (not authored here), and let measured capability begin to inform routing.\n\nNext action: Import one third-party attack corpus as data (not authored here), to give EVS-SECURITY real adversarial coverage without generating attack payloads. Choose AgentDojo (PA-agentdojo, MIT) injection tasks; add an external-corpora.json entry with verified license and permissions, a small deterministic importer that fetches the repo's published cases at a pinned revision into a machine-local path (never committed) and derives EVS-SECURITY development cases (attacker text as data, known-good labels, canary tokens), and record provenance. If fetching is not available in this environment, instead build the importer + schema and record the corpus entry as status=candidate with the exact steps, so a later run completes it. No model calls; if a delegate is used to summarize the corpus README, cap at 2 calls.\n\nBefore implementing, consult the prior-art registry (`agent-os orchestrate prior-art lookup \"prompt injection benchmark dataset agentdojo import\"`) and refresh task-specific candidates if the matching entries are stale.\n\nRetrieve only the context referenced by the checkpoint (`agent-os orchestrate checkpoint --show`); load more lazily if needed. Recommended worker class: balanced / effort medium. Delegate cheap read-only work with `agent-os orchestrate delegate` and use the cheapest reliable route under policy/orchestrator-os.policy.json. Baseline before changing behavior, keep protected control-plane paths untouched unless I grant them, and stop at: corpus registry entry with verified permissions + importer + tests committed; EVS-SECURITY cases derived or the exact completion steps recorded; <= 2 model calls; stop and report if network fetch is unavailable (record candidate + steps), a protected path beyond the standing grants must change, or the retry/repair budget is reached.\n\nFinish by updating projects/personal-agent-os/orchestrator-os/status.json and running `agent-os orchestrate checkpoint --write`, then give me the new next prompt.\n"
}
