{
  "schema": "personal-agent/orchestrator-checkpoint/v1",
  "id": "ORCH-0009",
  "previous": "ORCH-0008",
  "created_at": "2026-09-29T04:30:45.798332+00:00",
  "git": {
    "branch": "orchestrator-os/bootstrap-20260928",
    "commit": "73f7e06c",
    "dirty": true
  },
  "phase": "P1 foundations: control plane mutation-tested; evaluation breadth next",
  "completed": [
    "CAP records now distinguish accuracy-scored from contract-only evidence (pass_basis, mean_accuracy)",
    "EXP-0001 rejected HYP-0001: evidence verifier had no effect; offline replay predicted it before spend (e6d1f35a, EVR-0006, 9 calls, $1.02 measured)",
    "Run-to-run variance measured: Sonnet 0.55-0.80 on identical calls; all routes 0.67-0.70; voting <= 0.75; only 2/20 items stable (FND-0005, FND-0006)",
    "orchestrate eval gained +verify variants, --samples (paired), --max-calls budget, pooled item-level intervals, bounded parallelism",
    "EXP-0002: affected_test_selection family with deterministic labels; EVR-0007; deterministic import graph wins (DEC-0006, FND-0007, IMP-0006) (5587fbf5)",
    "IMP-0006 implemented: affected-tests-first validation, retries-only default (e7ad1ddc, 42ff2e4f; DEC-0007, EVR-0008..0011, HYP-0003)",
    "Prior-art registry + workflow integration (0d141ef8, DEC-0008)",
    "45 prior-art evaluations + discovery (bf11d932)",
    "Subsumed retry/breaker + key-optional API workers (36377edc, DEC-0009)",
    "IMP-0007 implemented: state-machine invariant tests with shrinking (EXP-0003, FND-0008, DEC-0010)",
    "IMP-0005 implemented: shared provider health, breaker, delegate deferral (aabff0ea, DEC-0011, FND-0009, EVR-0012)",
    "Mutation testing subsumed; control_plane.py 1.0 and fail-closed fix (10425545, EXP-0004, DEC-0012)"
  ],
  "active_objective": "Decide whether Inspect AI should be wrapped for evaluation breadth (sandboxes, external benchmarks) without surrendering Agent OS evaluator authority (IMP-0008).",
  "latest_evidence": [
    {
      "id": "DEC-0012",
      "type": "DEC",
      "title": "Subsumed mutation tester; control-plane guard fails closed",
      "path": "projects/personal-agent-os/orchestrator-os/records/decisions/DEC-0012.json",
      "updated_at": "2026-09-29T05:40:00+00:00"
    },
    {
      "id": "EXP-0004",
      "type": "EXP",
      "title": "Mutation testing of control-plane tests",
      "path": "projects/personal-agent-os/orchestrator-os/records/experiments/EXP-0004.json",
      "updated_at": "2026-09-29T05:40:00+00:00"
    },
    {
      "id": "DEC-0009",
      "type": "DEC",
      "title": "Subsume retry/backoff, circuit breaker and a key-optional direct API adapter",
      "path": "projects/personal-agent-os/orchestrator-os/records/decisions/DEC-0009.json",
      "updated_at": "2026-09-29T05:10:00+00:00"
    },
    {
      "id": "DEC-0011",
      "type": "DEC",
      "title": "Provider health shared across engine, delegate and eval; breaker for repeated unavailable failures",
      "path": "projects/personal-agent-os/orchestrator-os/records/decisions/DEC-0011.json",
      "updated_at": "2026-09-29T05:00:00+00:00"
    },
    {
      "id": "FAIL-0001",
      "type": "FAIL",
      "title": "Provider quota exhaustion blocked cheap-model delegation",
      "path": "projects/personal-agent-os/orchestrator-os/records/failures/FAIL-0001.json",
      "updated_at": "2026-09-29T05:00:00+00:00"
    },
    {
      "id": "FND-0009",
      "type": "FND",
      "title": "Quota cooldowns already existed in the engine; the bootstrap audit and FAIL-0001 missed them",
      "path": "projects/personal-agent-os/orchestrator-os/records/findings/FND-0009.json",
      "updated_at": "2026-09-29T05:00:00+00:00"
    },
    {
      "id": "DEC-0010",
      "type": "DEC",
      "title": "Orchestrator state-machine tests use the subsumed random-sequence runner; Hypothesis stays optional",
      "path": "projects/personal-agent-os/orchestrator-os/records/decisions/DEC-0010.json",
      "updated_at": "2026-09-29T04:40:00+00:00"
    },
    {
      "id": "EXP-0003",
      "type": "EXP",
      "title": "State-machine testing driver: subsumed random-sequence runner vs Hypothesis RuleBasedStateMachine",
      "path": "projects/personal-agent-os/orchestrator-os/records/experiments/EXP-0003.json",
      "updated_at": "2026-09-29T04:40:00+00:00"
    }
  ],
  "open_blockers": [],
  "active_experiments": [
    "HYP-0003 (monitoring): affected_tests_first always vs retries"
  ],
  "recent_decisions": [
    "DEC-0010",
    "DEC-0011",
    "DEC-0012"
  ],
  "next_action": {
    "summary": "IMP-0008 Inspect AI WRAP spike: in .agent-local/venv-dev install inspect-ai; write a throwaway bridge that runs EVS-TEST-SELECTION as an Inspect task (dataset = case file, solver = an Agent OS route through a custom ModelAPI or a solver that calls the deterministic import-graph route, scorer = the Agent OS recall/precision rule) and compare its results with `orchestrate eval` on the same cases. Measure: glue lines, installed dependency count and size, fidelity of results, what Inspect adds (sandboxes, eval-set resume, log viewer, inspect_evals ports) and whether suite definitions and promotion stay in Agent OS. Use deterministic routes only (0 model calls). Record EXP + DEC (prior_art note) and set PA-inspect-ai to WRAP or REJECT. Do not add inspect-ai to pyproject unless the DEC says WRAP, and then only as an optional extra.",
    "prior_art": "provider-neutral agent evaluation sandbox eval sets",
    "worker_class": "balanced",
    "effort": "medium",
    "why_this_class": "Integration spike with deterministic comparison; no model workers needed.",
    "context_refs": [
      "projects/personal-agent-os/improvements/IMP-0008.json",
      "projects/personal-agent-os/research/prior-art/registry.json",
      "src/agent_os/orchestrator/eval.py",
      "projects/personal-agent-os/orchestrator-os/evals/suites/EVS-TEST-SELECTION.json"
    ],
    "stop_conditions": [
      "EXP + DEC recorded; PA-inspect-ai decision updated with evidence",
      "0 model calls",
      "stop and report if inspect-ai cannot install in the isolated venv, a protected path must change, or the retry/repair budget is reached"
    ]
  },
  "context_refs": [
    "projects/personal-agent-os/improvements/IMP-0008.json",
    "projects/personal-agent-os/research/prior-art/registry.json",
    "src/agent_os/orchestrator/eval.py",
    "projects/personal-agent-os/orchestrator-os/evals/suites/EVS-TEST-SELECTION.json"
  ],
  "stopping_conditions": [
    "EXP + DEC recorded; PA-inspect-ai decision updated with evidence",
    "0 model calls",
    "stop and report if inspect-ai cannot install in the isolated venv, a protected path must change, or the retry/repair budget is reached"
  ],
  "approval_conditions": [
    "Standing authorization (operator, 2026-09-29): commit validated steps to orchestrator-os/bootstrap-20260928; after a gated pass, fast-forward main and push; protected paths only as already granted (validators.py, eval suites, evaluators, eval.py, control_plane.py, review.py, policy/**, AGENTS.md/CLAUDE.md when the next action needs them, each recorded in a DEC); <= 9 model calls per pass, <= $10 measured per night",
    "Operator decision still open: Q-0002 (qualification on pooled item-level intervals)"
  ],
  "next_prompt": "Use the Personal Agent OS repository's canonical Orchestrator development workflow (docs/orchestrator-os/ENTRYPOINT.md) and resume from checkpoint ORCH-0009 (projects/personal-agent-os/orchestrator-os/checkpoints/ORCH-0009.json).\n\nCurrent objective: Decide whether Inspect AI should be wrapped for evaluation breadth (sandboxes, external benchmarks) without surrendering Agent OS evaluator authority (IMP-0008).\n\nNext action: IMP-0008 Inspect AI WRAP spike: in .agent-local/venv-dev install inspect-ai; write a throwaway bridge that runs EVS-TEST-SELECTION as an Inspect task (dataset = case file, solver = an Agent OS route through a custom ModelAPI or a solver that calls the deterministic import-graph route, scorer = the Agent OS recall/precision rule) and compare its results with `orchestrate eval` on the same cases. Measure: glue lines, installed dependency count and size, fidelity of results, what Inspect adds (sandboxes, eval-set resume, log viewer, inspect_evals ports) and whether suite definitions and promotion stay in Agent OS. Use deterministic routes only (0 model calls). Record EXP + DEC (prior_art note) and set PA-inspect-ai to WRAP or REJECT. Do not add inspect-ai to pyproject unless the DEC says WRAP, and then only as an optional extra.\n\nBefore implementing, consult the prior-art registry (`agent-os orchestrate prior-art lookup \"provider-neutral agent evaluation sandbox eval sets\"`) and refresh task-specific candidates if the matching entries are stale.\n\nRetrieve only the context referenced by the checkpoint (`agent-os orchestrate checkpoint --show`); load more lazily if needed. Recommended worker class: balanced / effort medium. Delegate cheap read-only work with `agent-os orchestrate delegate` and use the cheapest reliable route under policy/orchestrator-os.policy.json. Baseline before changing behavior, keep protected control-plane paths untouched unless I grant them, and stop at: EXP + DEC recorded; PA-inspect-ai decision updated with evidence; 0 model calls; stop and report if inspect-ai cannot install in the isolated venv, a protected path must change, or the retry/repair budget is reached.\n\nFinish by updating projects/personal-agent-os/orchestrator-os/status.json and running `agent-os orchestrate checkpoint --write`, then give me the new next prompt.\n"
}
